{
	"$schema": "../schemas/project-structure.schema.json",
	"metadata": {
		"project_name": "MyNook",
		"version": "1.0.0",
		"generated_at": "2025-01-25",
		"development_phase": "planning",
		"structure_hash": "a4b5c6d7e8f9a0b1c2d3e4f5a6b7c8d9e0f1a2b3c4d5e6f7a8b9c0d1e2f3a4b5"
	},
	"validation_config": {
		"enforce_dependencies": true,
		"allow_orphaned_files": false,
		"require_documentation": ["critical", "high"]
	},
	"structure": {
		"docs/": {
			"type": "directory",
			"status": "exists",
			"priority": "critical",
			"purpose": "Central documentation hub containing all project specifications, architectural decisions, and development guidelines",
			"dependencies": [],
			"consumers": ["developers", "ai_assistants", "stakeholders"],
			"tags": ["core", "documentation"],
			"estimated_complexity": "simple",
			"last_validated": "2025-01-25T16:00:00Z",
			"checksum": null
		},
		"docs/requirements/": {
			"type": "directory",
			"status": "exists", 
			"priority": "critical",
			"purpose": "Requirements specifications defining application functionality, user stories, and acceptance criteria",
			"dependencies": ["docs/"],
			"consumers": ["developers", "ai_assistants", "stakeholders"],
			"tags": ["core", "documentation"],
			"estimated_complexity": "simple",
			"last_validated": "2025-01-25T16:00:00Z",
			"checksum": null
		},
		"docs/llm-context/core-requirements.json": {
			"type": "file",
			"status": "exists",
			"priority": "critical", 
			"purpose": "Machine-readable project requirements specification in structured JSON format for AI assistant consumption and validation",
			"dependencies": ["docs/llm-context/"],
			"consumers": ["ai_assistants", "developers", "build_system"],
			"tags": ["core", "config"],
			"estimated_complexity": "moderate",
			"last_validated": "2025-01-25T12:00:00Z",
			"checksum": "0e7543d76cbf95a2ac8c1a0bf8c8294a"
		},
		"docs/llm-context/": {
			"type": "directory",
			"status": "exists",
			"priority": "high",
			"purpose": "Specialized documentation providing comprehensive context and guidance for AI assistant development support",
			"dependencies": ["docs/"],
			"consumers": ["ai_assistants"],
			"tags": ["tooling", "documentation"],
			"estimated_complexity": "simple",
			"last_validated": "2025-01-25T16:00:00Z",
			"checksum": null
		},
		"docs/llm-context/project-context.md": {
			"type": "file",
			"status": "exists",
			"priority": "critical",
			"purpose": "Comprehensive project context for AI assistants including architectural decisions, constraints, and development patterns",
			"dependencies": ["docs/llm-context/core-requirements.json"],
			"consumers": ["ai_assistants"],
			"tags": ["tooling", "documentation"],
			"estimated_complexity": "moderate",
			"tech_debt_notes": [
				{
					"issue": "Critical blocking dependency for AI-assisted development workflow",
					"severity": "high",
					"remediation_effort": "hours",
					"created_at": "2025-01-24"
				}
			],
			"last_validated": "2025-01-25T11:48:00Z",
			"checksum": "0dc31b2b6450616096d0172df5c6610f"
		},
		"docs/schemas/": {
			"type": "directory", 
			"status": "exists",
			"priority": "medium",
			"purpose": "JSON Schema definitions for structured data validation and AI assistant consumption",
			"dependencies": ["docs/"],
			"consumers": ["build_system", "ai_assistants", "developers"],
			"tags": ["config", "tooling"],
			"estimated_complexity": "simple",
			"last_validated": "2025-01-25T16:00:00Z",
			"checksum": null
		},
		"docs/schemas/project-structure.schema.json": {
			"type": "file",
			"status": "exists",
			"priority": "medium",
			"purpose": "JSON Schema for validating project structure specifications and ensuring consistency across development phases",
			"dependencies": ["docs/schemas/"],
			"consumers": ["build_system", "ai_assistants"],
			"tags": ["config", "tooling"],
			"estimated_complexity": "complex",
			"last_validated": "2025-01-25T16:00:00Z",
			"checksum": "d6041de5bed435d2ddedb1a455f6824c"
		},
		"README.md": {
			"type": "file",
			"status": "exists",
			"priority": "critical",
			"purpose": "Primary project overview providing quick-start information, architecture summary, and navigation to detailed documentation",
			"dependencies": [],
			"consumers": ["developers", "stakeholders", "ai_assistants"],
			"tags": ["documentation"],
			"estimated_complexity": "simple",
			"last_validated": "2025-01-25T16:00:00Z",
			"checksum": "6df34e1c04e027c7df02082ff77d411d"
		},
		".github/": {
			"type": "directory",
			"status": "exists", 
			"priority": "medium",
			"purpose": "GitHub-specific configuration including CI/CD workflows, issue templates, and pull request automation",
			"dependencies": [],
			"consumers": ["build_system", "developers"],
			"tags": ["tooling", "deployment"],
			"estimated_complexity": "moderate",
			"last_validated": "2025-01-25T16:00:00Z",
			"checksum": null
		},
		".gitignore": {
			"type": "file",
			"status": "exists",
			"priority": "high",
			"purpose": "Git ignore patterns to exclude temporary files, dependencies, and sensitive data from version control",
			"dependencies": [],
			"consumers": ["developers", "build_system"],
			"tags": ["config", "tooling"],
			"estimated_complexity": "simple",
			"last_validated": "2025-01-25T16:00:00Z",
			"checksum": "4cef2da1a839c5b2a5b0feb8bbc42562"
		},
		".gitattributes": {
			"type": "file",
			"status": "exists",
			"priority": "low",
			"purpose": "Git attributes configuration for consistent line endings and file handling across different operating systems",
			"dependencies": [],
			"consumers": ["developers", "build_system"],
			"tags": ["config"],
			"estimated_complexity": "trivial",
			"last_validated": "2025-01-25T16:00:00Z",
			"checksum": "05bdb783ee6514c8c072e47680af8ff7"
		}
	},
	"dependency_graph": {
		"critical_path": [
			"docs/llm-context/core-requirements.json",
			"docs/llm-context/project-context.md",
			"docs/llm-context/project-structure.json"
		],
		"parallel_groups": [
			["docs/schemas/project-structure.schema.json", "package.json"],
			[".github/", "README.md"]
		],
		"orphaned_nodes": [
			".gitignore",
			".gitattributes",
			"package-lock.json"
		]
	}
}